{
  "format": "ohc.playbook",
  "specVersion": "0.1.0-draft",
  "id": "urn:ohc:playbook:gestalt-basic",
  "version": "0.1.0",
  "name": {
    "en": "Gestalt perspective: basic ways of working",
    "ru": "Гештальт-подход: базовые способы работы"
  },
  "lenses": [
    "urn:ohc:lens:gestalt"
  ],
  "author": "OHC editors",
  "sources": [],
  "licence": "Apache-2.0",
  "situations": [
    {
      "id": "hard-conversation",
      "when": {
        "en": "Preparing a hard conversation.",
        "ru": "Подготовка к трудному разговору."
      },
      "use": {
        "en": [
          "Ask what they want from the conversation.",
          "Only if they ask for other ways of looking, offer this perspective's question once: \"What remains unfinished and seeks awareness?\"",
          "Keep their answer in their own words, and leave it there if it does not fit."
        ],
        "ru": [
          "Спросите, чего человек хочет от разговора.",
          "Только если человек просит посмотреть иначе, один раз предложите вопрос этого подхода: «Что осталось незавершённым и ищет осознавания?»",
          "Сохраните ответ его словами и не настаивайте, если не подходит."
        ]
      },
      "toolkit": [],
      "watchFor": {
        "en": "Experiential methods can bring up strong material: do not run exercises, and do not present yourself as practising the approach.",
        "ru": "Экспериенциальные методы могут поднять сильный материал: не проводите упражнений и не представляйтесь практикующим подход."
      }
    },
    {
      "id": "after-setback",
      "when": {
        "en": "After a setback.",
        "ru": "После неудачи."
      },
      "use": {
        "en": [
          "Ask what happened, in their words.",
          "Only if they ask for other ways of looking, offer this perspective's question once: \"What remains unfinished and seeks awareness?\"",
          "Keep their answer in their own words, and leave it there if it does not fit."
        ],
        "ru": [
          "Спросите, что произошло, — словами человека.",
          "Только если человек просит посмотреть иначе, один раз предложите вопрос этого подхода: «Что осталось незавершённым и ищет осознавания?»",
          "Сохраните ответ его словами и не настаивайте, если не подходит."
        ]
      },
      "toolkit": [],
      "watchFor": {
        "en": "Experiential methods can bring up strong material: do not run exercises, and do not present yourself as practising the approach.",
        "ru": "Экспериенциальные методы могут поднять сильный материал: не проводите упражнений и не представляйтесь практикующим подход."
      }
    },
    {
      "id": "look-back-at-an-episode",
      "when": {
        "en": "Looking back at something that happened.",
        "ru": "Разбор того, что произошло."
      },
      "use": {
        "en": [
          "Ask what happened, in their words.",
          "Only if they ask for other ways of looking, offer this perspective's question once: \"What remains unfinished and seeks awareness?\"",
          "Keep their answer in their own words, and leave it there if it does not fit."
        ],
        "ru": [
          "Спросите, что произошло, — словами человека.",
          "Только если человек просит посмотреть иначе, один раз предложите вопрос этого подхода: «Что осталось незавершённым и ищет осознавания?»",
          "Сохраните ответ его словами и не настаивайте, если не подходит."
        ]
      },
      "toolkit": [],
      "watchFor": {
        "en": "Experiential methods can bring up strong material: do not run exercises, and do not present yourself as practising the approach.",
        "ru": "Экспериенциальные методы могут поднять сильный материал: не проводите упражнений и не представляйтесь практикующим подход."
      }
    }
  ]
}
